2dunet/test_matrics_all.csv

case_id,root_dice,root_hd95_mm,root_asd_mm,root_boundary_iou,dura_dice,dura_hd95_mm,dura_asd_mm,dura_boundary_iou
case003,0.7476817230032905,9.440604209899902,1.7669787664894299,0.436249626754255,0.881182647140094,2.7950849533081055,0.770449378631797,0.38969873663751214
case006,0.7155589508530685,19.691051483154297,2.395092873990654,0.4388586956521739,0.879335053023789,2.7950849533081055,0.8458866755544696,0.40561224489795916
case010,0.0,inf,inf,0.0,0.0,inf,inf,0.0
case011,0.728655822610666,27.382593154907227,3.1031192492626922,0.38964371980676327,0.7190667431631287,3.75,1.2084116432942347,0.24727100142382535
case036,0.5123564895894143,30.642620086669922,5.513380524232056,0.22255854707662898,0.0,inf,inf,0.0
case037,0.6174245643858903,37.1602897644043,5.138937239132078,0.3186555115220901,0.0,inf,inf,0.0
case039,0.7189331178015761,10.957303047180176,1.8700009924489742,0.4411495515284642,0.0,inf,inf,0.0
case040,0.3248811410459588,56.415531158447266,13.132088788410822,0.12960893854748604,0.0,inf,inf,0.0
MEAN,0.545686476161233,inf,inf,0.2970905738609827,0.30994805541587644,inf,inf,0.13032274786991208
mt_aug

case_id,dice,hd95_mm,asd_mm,boundary_iou
case003,0.7455777525901794,5.0,1.2370418045860987,0.2636553836957334
case006,0.6441295742988586,14.142135620117188,3.4725413097189124,0.19614382490880666
case010,0.003816410666331649,129.45269775390625,35.14775956352109,0.0013885031935573452
case011,0.7170573472976685,15.65247631072998,2.421220612180776,0.24756276583731698
case036,0.5808435678482056,41.19466018676758,6.57270180460687,0.17260511813995622
case037,0.5681600570678711,31.128765106201172,5.402705598791897,0.1811932042670881
case039,0.6968840956687927,7.348469257354736,1.7868515493897852,0.25157262228898697
case040,0.35114678740501404,22.022714614868164,5.349782511976118,0.08846387036322549
MEAN,0.5384519491053652,33.24273985624313,7.673825594346444,0.1753231615868339
cubic

C:\Users\orilab\Desktop\masumoto\2dunet\ckpt3d\best_3dunet_nerve.pth
case_id,dice,hd95_mm,asd_mm,boundary_iou
case003,0.750826,6.128825,1.230397,0.401016
case006,0.676770,20.440072,3.727954,0.338425
case010,0.000000,inf,inf,0.000000
case011,0.726411,30.853280,3.825686,0.382976
case036,0.632188,32.655503,4.548336,0.308697
case037,0.633059,32.015621,5.237342,0.326393
case039,0.732751,12.000000,1.784127,0.425202
case040,0.374045,34.129165,8.411133,0.155273
MEAN,0.565756,24.031781,4.109282,0.292248
3d

case_id,root_dice,root_hd95_mm,root_asd_mm,root_boundary_iou,dura_dice,dura_hd95_mm,dura_asd_mm,dura_boundary_iou
case003,0.776633,5.590170,0.898196,0.602588,0.886557,2.500000,0.428551,0.558123
case006,0.703613,17.544586,2.534696,0.529684,0.877334,3.000000,0.884155,0.514134
case010,0.022834,107.613464,56.195290,0.011234,0.000000,inf,inf,0.000000
case011,0.701618,28.925325,3.684045,0.503577,0.830201,2.500000,0.471745,0.482882
case036,0.466973,24.507654,5.682425,0.278245,0.000000,inf,inf,0.000000
case037,0.575457,35.114990,5.753678,0.377720,0.000000,inf,inf,0.000000
case039,0.677852,9.424039,1.621583,0.501722,0.000000,inf,inf,0.000000
case040,0.412988,35.728893,7.043595,0.243188,0.000000,inf,inf,0.000000
MEAN,0.542246,33.056137,10.426688,0.380995,0.324262,2.666667,0.594817,0.194392
multi

case_id,dice,hd95_mm,asd_mm,boundary_iou
case003,0.8584638329605476,3.48209706929603,0.7931007134719482,0.5194130632385404
case006,0.8490604996903786,3.75,1.0281874074870743,0.5025622901572716
case010,0.7956953085590518,9.0,1.8349282246064897,0.4971836274877957
case011,0.6765521534893448,6.751581639219492,1.4396075176550804,0.38263629151082396
case036,0.584088465673795,31.38221819537351,6.151387673012564,0.3041871921182266
case037,0.6512418089154184,41.4828159217512,6.024396611920797,0.36436950146627567
case039,0.7492509556774983,7.810249675906654,1.7632185496901673,0.45672797676669896
case040,0.49691406868254956,54.63892009737202,10.654685355063291,0.24154467440686522
MEAN,0.7076583867060731,19.787235324864863,3.7111890066134263,0.40857807714406225
nn

case_id,root_dice,root_hd95_mm,root_asd_mm,root_boundary_iou,dura_dice,dura_hd95_mm,dura_asd_mm,dura_boundary_iou
case003,0.757257,4.358899,1.266274,0.418769,0.873697,2.000000,0.419895,0.376338
case006,0.685409,12.449900,2.324880,0.372503,0.888116,2.000000,0.365130,0.402011
case010,0.201207,73.790245,23.869886,0.083018,0.012092,100.946518,49.010910,0.004415
case011,0.696659,29.000000,3.830892,0.355870,0.758369,3.000000,0.669232,0.255068
case036,0.627059,19.107527,2.676356,0.289571,0.000000,inf,inf,0.000000
case037,0.618268,33.749073,4.887876,0.309936,0.000000,inf,inf,0.000000
case039,0.712620,6.403124,1.162390,0.388051,0.000000,inf,inf,0.000000
case040,0.390921,43.931767,8.627275,0.153755,0.000000,inf,inf,0.000000
MEAN,0.586175,27.848816,6.080729,0.296434,0.316534,26.986629,12.616292,0.129729
3d multi isotropic augmented

case_id,root_dice,root_hd95_mm,root_asd_mm,root_boundary_iou,dura_dice,dura_hd95_mm,dura_asd_mm,dura_boundary_iou
case003,0.746925,5.099020,0.868045,0.406349,0.880159,2.000000,0.391706,0.378621
case006,0.682798,12.727922,2.156555,0.359441,0.888446,1.414214,0.408855,0.381264
case010,0.196476,79.271683,24.664865,0.071525,0.000000,inf,inf,0.000000
case011,0.702948,23.939457,3.107344,0.359561,0.786368,2.828427,0.589675,0.266817
case036,0.578307,20.615528,3.527001,0.253647,0.000000,inf,inf,0.000000
case037,0.63
1105,28.178005,4.313940,0.314527,0.000000,inf,inf,0.000000
case039,0.663031,10.344080,1.609834,0.351175,0.000000,inf,inf,0.000000
case040,0.448107,35.351803,6.470187,0.185811,0.000000,inf,inf,0.000000
MEAN,0.581212,26.940937,5.839722,0.287754,0.319372,2.080880,0.463412,0.128338
3d multi isotropic 

case_id,root_dice,root_hd95_mm,root_asd_mm,root_boundary_iou
case003,0.733183,9.424039,1.734303,0.549916
case006,0.674407,25.374918,4.299755,0.498085
case010,0.666847,18.918571,3.222165,0.480006
case011,0.709269,7.905694,2.017280,0.513248
case036,0.558819,21.727001,4.407465,0.359446
case037,0.581471,32.025867,4.650287,0.384240
case039,0.697601,10.594810,1.909620,0.517113
case040,0.383956,34.066330,6.843413,0.226312
MEAN,0.625694,20.004654,3.635536,0.441046
2d

case_id,root_dice,root_hd95_mm,root_asd_mm,root_boundary_iou,dura_dice,dura_hd95_mm,dura_asd_mm,dura_boundary_iou
case003,0.731969,9.273619,1.882244,0.546522,0.789630,42.965103,6.812464,0.458304
case006,0.638849,24.889978,4.508564,0.459512,0.830714,64.588943,7.720596,0.499321
case010,0.674406,21.154181,3.406342,0.489191,0.789717,4.100305,1.390477,0.516887
case011,0.713984,7.504166,1.390736,0.519904,0.772297,22.474638,2.687056,0.417019
case036,0.538737,39.586296,6.398317,0.339831,0.000000,inf,inf,0.000000
case037,0.556662,26.279745,4.835673,0.361724,0.000000,inf,inf,0.000000
case039,0.672841,17.566990,2.828550,0.485795,0.000000,inf,inf,0.000000
case040,0.371146,32.172737,7.129328,0.220774,0.000000,inf,inf,0.000000
MEAN,0.612324,22.303465,4.047469,0.427906,0.397795,33.532246,4.652648,0.236441
2s multi

2dunet/readme.md

case003: 0.7508
case006: 0.6768
case010: 0.0000
case011: 0.7264
case036: 0.6322
case037: 0.6331
case039: 0.7328
case040: 0.3740
Mean Dice (nerve root): 0.5658

ckpt = torch.load(best_path, map_location=device)
=== Case-wise Dice (nerve root only) ===
case003.nii: 0.7766
case006.nii: 0.7036
case010.nii: 0.0228
case011.nii: 0.7016
case036.nii: 0.4670
case037.nii: 0.5755
case039.nii: 0.6779
case040.nii: 0.4130
Mean Dice (nerve root): 0.5422

python train_3d_multi_augument.py --dataset_root "C:\Users\orilab\Desktop\masumoto\2dunet\Dataset" --epochs 1000 --batch_size 1 --lr 1e-3 --nerve_root_label 1 --dura_label 2 --save_name "multitask_crop_aug_lr1e3"l
=== Case-wise Dice (nerve root only) ===
case003.nii: 0.7477
case006.nii: 0.7156
case010.nii: 0.0000
case011.nii: 0.7287
case036.nii: 0.5124
case037.nii: 0.6174
case039.nii: 0.7189
case040.nii: 0.3249
Mean Dice (nerve root): 0.5457

python train_3d_multi_augument.py --dataset_root "C:\Users\orilab\Desktop\masumoto\2dunet\Dataset" --epochs 1000 --batch_size 1 --lr 1e-3 --nerve_root_label 1 --dura_label 2 --save_name "multitask_crop_aug_lr1e3"
=== Case-wise Dice (nerve root only) ===
case003.nii: 0.7477
case006.nii: 0.7156
case010.nii: 0.0000
case011.nii: 0.7287
case036.nii: 0.5124
case037.nii: 0.6174
case039.nii: 0.7189
case040.nii: 0.3249
Mean Dice (nerve root): 0.5457
Saved Dice results to ./ckpt3d_mt\dice_nerve_cropped.txt

キュービック補間
python train_3d_cubic.py --dataset_root "C:\Users\orilab\Desktop\masumoto\2dunet\Dataset" --epochs 1000 --batch_size 1 --lr 1e-3 --out_dir "C:\Users\orilab\Desktop\masumoto\2dunet\ckpt3d-cubic-3"
=== Case-wise Dice (nerve root only) ===
case003.nii: 0.7456
case006.nii: 0.6441
case010.nii: 0.0038
case011.nii: 0.7171
case036.nii: 0.5808
case037.nii: 0.5682
case039.nii: 0.6969
case040.nii: 0.3511
Mean Dice (nerve root): 0.5385